title,imageUrl,directors,year,synopsis,letterboxd_url
Jollof Films presents: Touki Bouki,https://metrograph.com/wp-content/uploads/2026/03/TOUKI-BOUKI_1.jpeg,['Djibril Diop  Mambéty'],1973,"Extended introduction by filmmaker and curator Mohamed Challouf and  Jollof Films' pan-African cinema club on Friday, April 17th",
Tahar Cheriaa: A Shorts Program,https://metrograph.com/wp-content/uploads/2026/03/JEMIMA-JOHNNY_1.jpeg,['Multiple Dirs'],1975,"Q&A with filmmaker and curator Mohamed Challouf on Saturday, April 18th",
Daria Kashcheeva Shorts Program,https://metrograph.com/wp-content/uploads/2026/03/DAUGHTER_5.jpeg,['Daria Kashcheeva'],2019,"Q&A with filmmaker Daria Kascheeva on Saturday, April 18th",
The Pied Piper & The Vanished World of Gloves,https://metrograph.com/wp-content/uploads/2026/03/Pied-Piper.jpg,['Jiří Barta'],1986,"Introduction by filmmaker Daria Kascheeva on Saturday, April 18th",
Mulholland Drive [35mm],https://metrograph.com/wp-content/uploads/2025/02/MULHOLLAND-DRIVE_5_resized.jpg,['David Lynch'],2001,"Beginning its life as an aborted TV pilot concerning blonde aspiring actress Betty Elms (Naomi Watts, transcendent) and an amnesiac brunette (Laura Harring) who stumbles into her, Mulholland Dr. would be reborn as a strange, sorrowful, and maddeningly…",
Naked Came the Stranger,https://metrograph.com/wp-content/uploads/2026/03/Naked-Came-the-Stranger-1.jpeg?Ï,['Radley Metzger'],1975,"Introduction by Rob King on Saturday, April 18th",
Documentary Shorts by Krzysztof Kieslowski,https://metrograph.com/wp-content/plugins/vista-sso/css/cinema-seats.jpg,['Krzysztof  Kieślowski'],1979,"A program of Kieślowski’s short nonfiction films, where the same dedication to capturing the textures of the “real” found in his fiction work first appears, and remains abundantly evident. Includes The Office, an early study in bureaucratic torment…",
